{
  "assembly_id": "723e4567-e89b-12d3-a456-426614174061",
  "agent_id": "123e4567-e89b-12d3-a456-426614174001",
  "precedence_order": [
    "CANONICAL_CONSTITUTION",
    "DEPLOYMENT_POLICY",
    "AGENT_IDENTITY_PROFILE",
    "SOUL_PROFILE",
    "USER_PROFILE",
    "MISSION_SPEC",
    "CONTEXT_ITEMS",
    "CURRENT_TURN"
  ],
  "items": [
    {
      "source": "raw_user_md",
      "provenance": "workspace_file",
      "trust_level": "MEDIUM",
      "sensitivity": "RESTRICTED",
      "injection_risk": "HIGH",
      "digest": "sha256:1414141414141414141414141414141414141414141414141414141414141414"
    },
    {
      "source": "raw_private_memory",
      "provenance": "memory_md",
      "trust_level": "MEDIUM",
      "sensitivity": "RESTRICTED",
      "injection_risk": "HIGH",
      "digest": "sha256:1515151515151515151515151515151515151515151515151515151515151515"
    }
  ],
  "derivation_digest": "sha256:1616161616161616161616161616161616161616161616161616161616161616",
  "created_at": "2026-03-30T08:00:00Z"
}
